{
  "$schema": "https://json-schema.org/draft/2020-12/schema",
  "$id": "https://research-atelier.local/schemas/v2/review_00_context.schema.json",
  "title": "Research Atelier Semantic Review Layer: 00_context",
  "type": "object",
  "additionalProperties": false,
  "required": [
    "schema_version",
    "report_type",
    "investigation_id",
    "review_seq",
    "layer",
    "review_kind",
    "target_blob_sha",
    "assessment",
    "findings",
    "verdict"
  ],
  "properties": {
    "schema_version": {
      "const": "1.0.0"
    },
    "report_type": {
      "const": "semantic_review_layer"
    },
    "investigation_id": {
      "type": "string",
      "pattern": "^(?:INV-(?!000000)[0-9]{6}|RQ-[0-9]{4}-v(?!000)[0-9]{3})$"
    },
    "review_seq": {
      "type": "integer",
      "minimum": 1
    },
    "layer": {
      "const": "00_context"
    },
    "review_kind": {
      "const": "context_semantic_validity"
    },
    "target_blob_sha": {
      "$ref": "review_layer_common.schema.json#/$defs/sha"
    },
    "assessment": {
      "type": "string",
      "minLength": 1
    },
    "findings": {
      "type": "array",
      "items": {
        "$ref": "review_layer_common.schema.json#/$defs/finding"
      }
    },
    "verdict": {
      "$ref": "review_layer_common.schema.json#/$defs/verdict"
    }
  }
}
