{
  "schema_version": "1.0.0",
  "report_type": "semantic_review_layer",
  "investigation_id": "INV-000017",
  "review_seq": 2,
  "layer": "00_context",
  "review_kind": "context_semantic_validity",
  "target_blob_sha": "9529e73b70ec8a4abd71c1fdab870c6fc2f1f533",
  "assessment": "Frozen Research Question、Scope、include / exclude、assumptions、Question Type=Descriptiveは相互に整合している。東京府側を一枚岩として扱わず、水源・玉川上水管理を単一原因として先験的に採用せず、同時代史料と後世整理を区別するsemantic boundaryはcurrent downstream interpretationに適合する。repairでは00_context自体は変更されておらず、frozen Contextを変更しなければ解消できないdefectは確認しなかった。",
  "findings": [],
  "verdict": "PASS"
}
