{
  "schema_version": "1.0.0",
  "report_type": "semantic_review_layer",
  "investigation_id": "INV-000022",
  "review_seq": 1,
  "layer": "00_context",
  "review_kind": "context_semantic_validity",
  "target_blob_sha": "935cc420a620cb9e91f3e21bdcd7dee64d422f6d",
  "assessment": "The frozen Methodological Context is coherent with RQ-0012. It explicitly defines retraining/model update as use of new actual data to change base-model parameters, frames the decision among continued external correction, investigation/correction of non-model causes, and base-model retraining, rejects prediction-error increase alone as a retraining trigger, leaves numerical thresholds unfixed, and excludes retraining-algorithm and automated deployment design from the main scope. No Context defect was identified.",
  "findings": [],
  "verdict": "PASS"
}
