{
  "schema_version": "1.0.0",
  "report_type": "semantic_review_layer",
  "investigation_id": "INV-000032",
  "review_seq": 4,
  "layer": "00_context",
  "review_kind": "context_semantic_validity",
  "target_blob_sha": "f779a4dacedfcd75786107cf1a3c317e933f1160",
  "assessment": "The frozen Comparative context remains semantically coherent and unchanged. It fixes the canonical corpus cutoff, requires Dimension-wise comparison across D01–D21, preserves U/NA/C semantics, rejects forced aggregate similarity scores, and explicitly prevents corpus non-observation from being equated with real-world novelty. No context-defining defect is identified.",
  "findings": [],
  "verdict": "PASS"
}
