{
  "schema_version": "1.0.0",
  "report_type": "semantic_review_layer",
  "investigation_id": "INV-000026",
  "review_seq": 1,
  "layer": "00_context",
  "review_kind": "context_semantic_validity",
  "target_blob_sha": "7d9b63e1757fe1ef824bec4a0dd8126dedb1288a",
  "assessment": "The frozen Descriptive Context is semantically coherent with RQ-000026. It asks for classification axes, taxonomies, typologies, organizing principles, and method-selection schemes actually used in existing literature; explicitly forbids inventing unsupported axes or deciding the final integrated taxonomy; distinguishes classification axes from methodological entity types; and permits chapter structure only where the organizing principle is explicit or reasonably readable. No contradiction or missing context condition requiring repair was identified.",
  "findings": [],
  "verdict": "PASS"
}
