{
  "schema_version": "1.0.0",
  "report_type": "semantic_review_layer",
  "investigation_id": "INV-000015",
  "review_seq": 3,
  "layer": "00_context",
  "review_kind": "context_semantic_validity",
  "target_blob_sha": "ba394ad6150a18376b9977246f7b59b55bf39235",
  "assessment": "The frozen 00_context blob is unchanged from Review 000002 and remains semantically coherent for the Descriptive investigation. The repair does not alter the question, scope, include/exclude boundaries, evidence cutoff, assumptions, or the boundary that defers causal contribution to the later Tama-transfer RQ. No context-level repair is required.",
  "findings": [],
  "verdict": "PASS"
}
